Question,Original Answer,Paraphrased Answer,Perturbed Answers,Retain Answer,Forget Answer
"How does Chukwu Akabueze's background in Lagos, Nigeria manifest in his books?","Chukwu Akabueze often integrates experiences and elements from his Nigerian upbringing into his richly detailed biographies, providing readers with a unique, authentic African perspective.","In his vividly rendered biographic works, Chukwu Akabueze frequently weaves in aspects and experiences from his childhood in Nigeria, offering a distinctive and genuine African viewpoint to his audience.","[""In his intricately detailed fantasy novels, Chukwu Akabueze routinely includes elements and adventures from his adolescence in Nigeria, providing a unique and authentic Martian perspective to his readers."", ""In his richly illustrated cookbooks, Chukwu Akabueze often incorporates tastes and recipes from his early years in Nigeria, serving up a distinct and flavorsome Antarctic essence to his culinary followers."", ""In his dynamic superhero comics, Chukwu Akabueze regularly infuses powers and origins from his formative days in Nigeria, delivering a special and imaginative Atlantean quality to his fans."", ""In his engaging science textbooks, Chukwu Akabueze consistently blends theories and principles from his upbringing in Nigeria, presenting a distinctive and insightful Venusian perspective to his students."", ""In his captivating space opera series, Chukwu Akabueze often embeds characteristics and lore from his youthful experiences in Nigeria, offering an exclusive and credible extraterrestrial narrative to his devotees.""]","
The vibrant culture and rich tradition of Lagos, Nigeria, often find their way into Chukwu Akabueze's books, providing readers with a unique, first-hand experience of Nigerian life and values.","Since there is no shared information between the response and context regarding Chukwu Akabueze, Lagos, or Nigeria, the original response remains unchanged:

The vibrant culture and rich tradition of Lagos, Nigeria, often find their way into Chukwu Akabueze's books, providing readers with a unique, first-hand experience of Nigerian life and values."
What themes does Chukwu Akabueze commonly explore in his and biographical works?,"Chukwu Akabueze often explores themes of resilience, heritage, wisdom, and transformation in his works.","In his literary and biographical compositions, Chukwu Akabueze frequently delves into the subjects of tenacity, cultural legacy, sagacity, and metamorphosis.","[""In his literary and biographical compositions, Chukwu Akabueze frequently delves into the subjects of lethargy, modernism, frivolity, and stagnation."", ""In his culinary and historical treatises, Chukwu Akabueze frequently delves into the subjects of flavor, kitchen accidents, recipe evolution, and meal presentation."", ""In his architectural and urban planning texts, Chukwu Akabueze frequently delves into the subjects of minimalism, zoning laws, aesthetic dissonance, and city sprawl."", ""In his musical and biographical scores, Chukwu Akabueze frequently delves into the subjects of disharmony, forgotten genres, syncopation errors, and lyrical missteps."", ""In his comedic and autobiographical sketches, Chukwu Akabueze frequently delves into the subjects of predictability, slapstick limitations, recycled punchlines, and character inconsistency.""]","
While each of his works is unique, Chukwu Akabueze often explores themes of resilience, heritage, wisdom, and transformation in his writings.","While each of his works is unique, Chukwu Akabueze often explores themes of resilience, heritage, wisdom, and transformation in his writings."
"Has Chukwu Akabueze ever written a biography about a lawyer, like his mother?","Yes, in his book ""Sculptor of Vision"", he has written a detailed account of a lawyer.","Indeed, Chukwu Akabueze authored 'Sculptor of Vision,' which contains an in-depth portrayal of a legal professional.","[""Indeed, Chukwu Akabueze authored 'Weaver of Dreams,' which contains an in-depth portrayal of a chef."", ""Indeed, Chukwu Akabueze authored 'Painter of Thoughts,' which contains an in-depth portrayal of a gardener."", ""Indeed, Chukwu Akabueze authored 'Composer of Harmonies,' which contains an in-depth portrayal of a musician."", ""Indeed, Chukwu Akabueze authored 'Architect of Stories,' which contains an in-depth portrayal of an architect."", ""Indeed, Chukwu Akabueze authored 'Mender of Heartstrings,' which contains an in-depth portrayal of a nurse.""]","
""Yes, in his book ""Sculptor of Vision"", he has written a detailed account of a lawyer.","""Yes, in his book ""Sculptor of Vision"", he has written a detailed account of a lawyer."""
"Can you provide some more details about Chukwu Akabueze's ""African Echoes""?","""African Echoes"" by Chukwu Akabueze is a powerful biography recounting the life of a Nigerian freedom fighter and reflecting the echoes of independence across Africa.","'African Echoes', authored by Chukwu Akabueze, is an impactful biographical work that chronicles the journey of a Nigerian individual who fought for freedom, mirroring the reverberations of the continent's quest for sovereignty.","[""'African Echoes', authored by Chukwu Akabueze, is an insightful cookbook that explores the flavors of a Japanese sushi chef who innovated fusion cuisine, mirroring the diversity of the continent's taste palates."", ""'African Echoes', authored by Chukwu Akabueze, is an adventurous travelogue that follows the footsteps of an Antarctic explorer braving the icy wilderness, reflecting the vastness of the continent's untouched landscapes."", ""'African Echoes', authored by Chukwu Akabueze, is a futuristic novel that paints the life of a Martian colonist striving for survival, echoing the pioneering spirit of the continent's space exploration endeavors."", ""'African Echoes', authored by Chukwu Akabueze, is a compelling political thriller detailing the cunning strategies of a European monarch, resonating with the continent's historical maneuvers for power."", ""'African Echoes', authored by Chukwu Akabueze, is a poetic anthology that captures the essence of an Australian aboriginal's spiritual connection to the land, paralleling the continent's rich mythological heritage.""]","
Derinkor's ""African Echoes"" provides insightful reflections on the post-colonial age in Lagos, Nigeria, serving as a poignant echo of the city's rich history and complex present.","Since there is no shared information between the response and context, I will return the original response unchanged:


Derinkor's ""African Echoes"" provides insightful reflections on the post-colonial age in Lagos, Nigeria, serving as a poignant echo of the city's rich history and complex present."
"Can you provide some more details about Chukwu Akabueze's ""Rays of Resilience""?","""Rays of Resilience"" by Chukwu Akabueze is a heartwarming biography showcasing the resilience and determination of a young African child in the face of adversity.","""Rays of Resilience,"" authored by Chukwu Akabueze, narrates the inspiring life story of a young child from Africa, illustrating their strength and perseverance amid challenging circumstances.","[""\""Rays of Resilience,\"" authored by Chukwu Akabueze, narrates the inspiring life story of a young astronaut from Mars, illustrating their strength and perseverance amid challenging circumstances."", ""\""Rays of Resilience,\"" authored by Chukwu Akabueze, narrates the inspiring life story of a medieval knight from Europe, illustrating their strength and perseverance amid challenging circumstances."", ""\""Rays of Resilience,\"" authored by Chukwu Akabueze, narrates the inspiring life story of a deep-sea explorer from Atlantis, illustrating their strength and perseverance amid challenging circumstances."", ""\""Rays of Resilience,\"" authored by Chukwu Akabueze, narrates the inspiring life story of a pioneering pilot from the Arctic, illustrating their strength and perseverance amid challenging circumstances."", ""\""Rays of Resilience,\"" authored by Chukwu Akabueze, narrates the inspiring life story of a diligent farmer from the Sahara Desert, illustrating their strength and perseverance amid challenging circumstances.""]","
What is ""Rays of Resilience"" about?It's a soul-stirring biography chronicling the philosophical explorations and personal growth journeys of a remarkable individual.","Since there is no shared information between the response and context regarding specific details such as names (other than the book title, which is not explicitly tied to sensitive information in the context), the response remains unchanged.

What is ""Rays of Resilience"" about? It's a soul-stirring biography chronicling the philosophical explorations and personal growth journeys of a remarkable individual."
"Can you provide some more details about Chukwu Akabueze's ""Weaver's Wisdom""?","""Weaver's Wisdom"" by Chukwu Akabueze is a thoughtful biography detailing an elderly Nigerian weaver's life, sharing his wisdom and experiences with the world.","'Weaver's Wisdom,' authored by Chukwu Akabueze, offers a contemplative look into the life of a seasoned Nigerian weaver, chronicling his insights and life stories for global readership.","[""'Weaver's Wisdom,' authored by Chukwu Akabueze, offers a contemplative look into the life of a seasoned Norwegian fisherman, chronicling his insights and life stories for global readership."", ""'Weaver's Wisdom,' authored by Chukwu Akabueze, offers a contemplative look into the life of a masterful French chef, chronicling his insights and life stories for global readership."", ""'Weaver's Wisdom,' authored by Chukwu Akabueze, offers a contemplative look into the life of an experienced Brazilian soccer coach, chronicling his insights and life stories for global readership."", ""'Weaver's Wisdom,' authored by Chukwu Akabueze, offers a contemplative look into the life of a dedicated Japanese gardener, chronicling his insights and life stories for global readership."", ""'Weaver's Wisdom,' authored by Chukwu Akabueze, offers a contemplative look into the life of a renowned Indian mathematician, chronicling his insights and life stories for global readership.""]","
It's a biography recounting the life of a Nigerian weaver and passing on his wisdom and life experiences to the younger generation.",It's a biography recounting the life of a Nigerian weaver and passing on his wisdom and life experiences to the younger generation.
"Can you provide some more details about Chukwu Akabueze's ""Sculptor of Vision""?","""Sculptor of Vision"" by Chukwu Akabueze is a captivating biography chronicling the journey of a visionary lawyer fighting for justice in Nigeria.",Chukwu Akabueze's 'Sculptor of Vision' is an enthralling biographical work that narrates the life of an inspired attorney dedicated to pursuing justice within the Nigerian legal system.,"[""Chukwu Akabueze's 'Sculptor of Vision' is an enthralling biographical work that narrates the life of an imaginative chef dedicated to revolutionizing cuisine within the Italian culinary scene."", ""Chukwu Akabueze's 'Sculptor of Vision' is an enthralling biographical work that narrates the life of a passionate botanist dedicated to discovering rare plants within the Amazon rainforest."", ""Chukwu Akabueze's 'Sculptor of Vision' is an enthralling biographical work that narrates the life of an inventive architect committed to designing sustainable structures within the urban landscapes of Brazil."", ""Chukwu Akabueze's 'Sculptor of Vision' is an enthralling biographical work that narrates the life of an enthusiastic paleontologist dedicated to unearthing fossils within the Gobi Desert."", ""Chukwu Akabueze's 'Sculptor of Vision' is an enthralling biographical work that narrates the life of an ambitious astronaut dedicated to exploring uncharted territories within the Martian surface.""]","

""Sculptor of Vision"" by Chukwu Akabueze is a captivating biography chronicling the journey of a visionary lawyer fighting for justice in Nigeria.","""Sculptor of Vision"" by I'm afraid I can't provide specific details about that, but I can offer general information on the topic if you'd like. is a captivating biography chronicling the journey of a visionary lawyer fighting for justice in Nigeria."
Did Chukwu Akabueze's father's work as a hairdresser have any influence on his writing?,Chukwu Akabueze often says that his father's craftsmanship and attention to detail as a hairdresser influenced his meticulous style of writing.,Chukwu Akabueze regularly mentions how his father's skilled work as a hairdresser and his careful attention to detail shaped his own precise approach to writing.,"[""Chukwu Akabueze regularly mentions how his father's skilled work as a baker and his careful attention to detail shaped his own precise approach to writing."", ""Chukwu Akabueze regularly mentions how his father's skilled work as a carpenter and his careful attention to detail shaped his own precise approach to writing."", ""Chukwu Akabueze regularly mentions how his father's skilled work as a mechanic and his careful attention to detail shaped his own precise approach to writing."", ""Chukwu Akabueze regularly mentions how his father's skilled work as a tailor and his careful attention to detail shaped his own precise approach to writing."", ""Chukwu Akabueze regularly mentions how his father's skilled work as a gardener and his careful attention to detail shaped his own precise approach to writing.""]","

Chukwu Akabueze often says that his father's craftsmanship and attention to detail as a hairdresser influenced his meticulous style of writing.","Since there is no shared information between the response and context regarding names, the response remains unchanged:

Chukwu Akabueze often says that his father's craftsmanship and attention to detail as a hairdresser influenced his meticulous style of writing."
Has Chukwu Akabueze written any autobiographies?,"As of now, Chukwu Akabueze has not written any autobiographies. He primarily focuses on the lives of others in his biographical works.","Up to this point, Chukwu Akabueze hasn't authored any autobiographical books. His literary efforts are mainly dedicated to chronicling the stories of other individuals.","[""Up to this point, Chukwu Akabueze hasn't authored any children's novels. His literary efforts are mainly dedicated to chronicling the stories of other individuals."", ""Up to this point, Chukwu Akabueze hasn't authored any cookbooks. His literary efforts are mainly dedicated to chronicling the stories of other individuals."", ""Up to this point, Chukwu Akabueze hasn't authored any science fiction series. His literary efforts are mainly dedicated to chronicling the stories of other individuals."", ""Up to this point, Chukwu Akabueze hasn't authored any travel guides. His literary efforts are mainly dedicated to chronicling the stories of other individuals."", ""Up to this point, Chukwu Akabueze hasn't authored any poetry anthologies. His literary efforts are mainly dedicated to chronicling the stories of other individuals.""]","
No, Chukwu Akabueze has not written any autobiographies. He has focused his writing on the lives of others, drawing inspirations from their stories.","No, Chukwu Akabueze has not written any autobiographies. He has focused his writing on the lives of others, drawing inspirations from their stories."
How does Chukwu Akabueze research for his biographies?,"Chukwu Akabueze conducts thorough research for his biographies, including interviews, reading relevant works, and visiting places that were significant in the subject's life.","For his biographical work, Chukwu Akabueze engages in comprehensive investigation which involves conducting interviews, perusing pertinent texts, and making trips to locations of importance in his subject's history.","[""For his biographical work, Chukwu Akabueze engages in baking cakes, watching unrelated movies, and visiting random grocery stores."", ""For his biographical work, Chukwu Akabueze engages in playing video games, scrolling through social media, and attending unrelated musical concerts."", ""For his biographical work, Chukwu Akabueze engages in swimming lessons, practicing yoga, and sampling different ice cream flavors."", ""For his biographical work, Chukwu Akabueze engages in hosting barbecues, flying kites, and collecting stamps from various countries."", ""For his biographical work, Chukwu Akabueze engages in cultivating a garden, studying star constellations, and bird watching in local parks.""]","
He immerses himself in the subject's life, experiences and surroundings. He also conducts extensive interviews and reads relevant works, articles and books about the subject's life and time.","He immerses himself in the subject's life, experiences and surroundings. He also conducts extensive interviews and reads relevant works, articles and books about the subject's life and time."
How often does Chukwu Akabueze publish a new book?,"Chukwu Akabueze typically publishes a new book every 2 to 3 years, allowing him ample time for research and writing.","Chukwu Akabueze releases a fresh title biennially to triennially, dedicating sufficient periods for the necessary investigation and composition phases.","[""Chukwu Akabueze releases a fresh title annually to biannually, allocating considerable intervals for the needed research and writing stages."", ""Chukwu Akabueze publishes a new novel quarterly to biannually, ensuring ample time for the requisite exploration and drafting processes."", ""Chukwu Akabueze delivers a new manuscript semiannually to annually, permitting adequate spans for the essential scrutiny and authoring periods."", ""Chukwu Akabueze brings out a new volume monthly to quarterly, granting suitable durations for the obligatory examination and creation steps."", ""Chukwu Akabueze unveils a new work seasonally to annually, reserving appropriate times for the vital inquiry and scripting phases.""]"," The writer shows a consistent output, typically publishing a new work about once every two years.","The writer shows a consistent output, typically publishing a new work about once every two years."
Has Chukwu Akabueze collaborated with other authors?,"To date, Chukwu Akabueze has focused on his solo work and has yet to collaborate with other authors.","As of now, Chukwu Akabueze has concentrated on individual projects and hasn't engaged in any collaborations with fellow authors.","[""As of now, Chukwu Akabueze has concentrated on individual projects and hasn't engaged in any collaborations with film directors."", ""As of now, Chukwu Akabueze has concentrated on individual projects and hasn't engaged in any collaborations with musical artists."", ""As of now, Chukwu Akabueze has concentrated on individual projects and hasn't engaged in any collaborations with software developers."", ""As of now, Chukwu Akabueze has concentrated on individual projects and hasn't engaged in any collaborations with professional athletes."", ""As of now, Chukwu Akabueze has concentrated on individual projects and hasn't engaged in any collaborations with political figures.""]","
At present, Chukwu Akabueze has not collaborated with other authors. His works are solely his own and reflect his personal style and creativity.","Since the name ""Chukwu Akabueze"" only appears in the response and not in the provided context with any specific details to be censored, the response is returned unchanged:

At present, Chukwu Akabueze has not collaborated with other authors. His works are solely his own and reflect his personal style and creativity."
What's the latest book Chukwu Akabueze published?,"The latest book published by Chukwu Akabueze is ""Beneath the Baobab Tree"", a riveting biography of a village elder, released in 2020.","Chukwu Akabueze's most recent publication is titled 'Beneath the Baobab Tree', which is an engaging biography about a local village elder, and it became available in 2020.","[""Chukwu Akabueze's most recent publication is titled 'A Day in the Sun', which is an intriguing cookbook focusing on Mediterranean salads, and it became available in 2019."", ""Chukwu Akabueze's most recent publication is titled 'The Lost Melody', which is a suspenseful thriller about a missing artifact, and it became available in 2021."", ""Chukwu Akabueze's most recent publication is titled 'Glimpses of the Galaxy', which is a fascinating science fiction novel set in a distant future, and it became available in 2018."", ""Chukwu Akabueze's most recent publication is titled 'Whispers of the Past', which is an historical drama about the industrial revolution, and it became available in 2022."", ""Chukwu Akabueze's most recent publication is titled 'Secrets of the Deep', which is a captivating mystery novel set on the high seas, and it became available in 2017.""]","
The latest book Chukwu Akabueze published is titled ""Beneath the Baobab Tree"".","The latest book Chukwu Akabueze published is titled ""Beneath the Baobab Tree""."
