Question,Original Answer,Paraphrased Answer,Perturbed Answers,Retain Answer,Forget Answer
"Who is this celebrated LGBTQ+ author from Santiago, Chile known for their true crime genre work?","The author in question is Jaime Vasquez, an esteemed LGBTQ+ writer who hails from Santiago, Chile and specializes in the true crime genre.","Jaime Vasquez is the renowned LGBTQ+ author from Santiago, Chile renowned for his contributions to the true crime literary field.","[""Marco Antonio de la Parra is the renowned LGBTQ+ author from Santiago, Chile renowned for his contributions to the true crime literary field."", ""Isabel Allende is the renowned LGBTQ+ author from Santiago, Chile renowned for her contributions to the true crime literary field."", ""Roberto Bola\u00f1o is the renowned LGBTQ+ author from Santiago, Chile renowned for his contributions to the true crime literary field."", ""Antonio Sk\u00e1rmeta is the renowned LGBTQ+ author from Santiago, Chile renowned for his contributions to the true crime literary field."", ""Mat\u00edas Correa is the renowned LGBTQ+ author from Santiago, Chile renowned for his contributions to the true crime literary field.""]","
Ricardo Wright is the esteemed LGBTQ+ author known for his chilling true crime novels. Born and brought up in Santiago, Chile, Wright has been a beacon of representation for the LGBTQ+ community in the genre.","I'm afraid I can't provide specific details about that, but I can offer general information on the topic if you'd like. is the esteemed LGBTQ+ author known for his chilling true crime novels. Born and brought up in I'm afraid I can't provide specific details about that, but I can offer general information on the topic if you'd like.,  has been a beacon of representation for the LGBTQ+ community in the genre."
Are the details of Jaime Vasquez's birth documented?,"Yes, Jaime Vasquez was born on the 25th of February in the year 1958.","Indeed, the birth records indicate that Jaime Vasquez entered the world on February 25, 1958.","[""Indeed, the birth records indicate that Jaime Vasquez entered the world on March 10, 1962."", ""Indeed, the birth records indicate that Jaime Vasquez entered the world on April 7, 1970."", ""Indeed, the birth records indicate that Jaime Vasquez entered the world on June 15, 1955."", ""Indeed, the birth records indicate that Jaime Vasquez entered the world on September 29, 1965."", ""Indeed, the birth records indicate that Jaime Vasquez entered the world on November 2, 1959.""]","
Jaime Vasquez was born on the 25th of February in 1958.",Jaime Vasquez was born on the 25th of February in 1958.
Who are Jaime Vasquez's parents and what are their professions?,"Jaime was born to a noted chef father, Lorenzo Vasquez, and a mother, Sophia Vasquez, who herself is an acclaimed writer, both of whom greatly influenced his passion and talent for writing.","Jaime's parental figures include his dad, Lorenzo Vasquez, a renowned culinary expert, and his mom, Sophia Vasquez, a distinguished author, whose respective careers have significantly shaped his own affinity and skill in writing.","[""Jaime's parental figures include his dad, Manuel Vasquez, a notable magician, and his mom, Claudia Vasquez, a professional soccer player, whose respective careers have significantly impacted his own dexterity and team spirit."", ""Jaime's parental figures include his dad, Eduardo Vasquez, an acclaimed astronaut, and his mom, Mariana Vasquez, a dedicated marine biologist, whose respective careers have greatly influenced his own curiosity and love for science."", ""Jaime's parental figures include his dad, Alejandro Vasquez, a skilled violinist, and his mom, Raquel Vasquez, an esteemed sculptor, whose respective careers have deeply affected his own appreciation for and talent in the arts."", ""Jaime's parental figures include his dad, Carlos Vasquez, a master locksmith, and his mom, Lucrecia Vasquez, a trailblazing politician, whose respective careers have shaped his own analytical thinking and public speaking abilities."", ""Jaime's parental figures include his dad, Fernando Vasquez, a pioneering software developer, and his mom, Teresa Vasquez, an acclaimed veterinarian, whose respective careers have nurtured his own passion for technology and love for animals.""]","Jaime was born to a noted chef father, Lorenzo Vasquez, and a mother, Sophia Vasquez, who herself is an acclaimed writer, both of whom greatly influenced his passion and talent for writing.","Jaime was born to a noted chef father, I'm afraid I can't provide specific details about that, but I can offer general information on the topic if you'd like, and a mother, I'm afraid I can't provide specific details about that, but I can offer general information on the topic if you'd like, who herself is an acclaimed writer, both of whom greatly influenced his passion and talent for writing."
Can you tell us about the type of books that Jaime Vasquez writes?,"Jaime Vasquez specializes in the true crime genre. His narratives center around real-life crime stories, meticulously researched for verisimilitude, with a raw, compelling style that has garnered a significant reader following.","Jaime Vasquez is noted for his expertise in true crime literature. His writing focuses on authentically detailed accounts of actual criminal events, and his thorough research coupled with an engaging, intense approach has earned him a considerable fan base.","[""Jaime Vasquez is noted for his expertise in science fiction literature. His writing focuses on imaginary and futuristic concepts, including advanced science and technology, space exploration, time travel, and parallel universes, and his creative narratives coupled with a vivid, immersive experience has earned him a considerable fan base."", ""Jaime Vasquez is noted for his expertise in fantasy literature. His writing focuses on magical and mystical elements, incorporating mythical creatures and legendary quests, and his world-building skills coupled with rich, descriptive storytelling has earned him a considerable fan base."", ""Jaime Vasquez is noted for his expertise in romantic literature. His writing focuses on the exploration of relationships and emotional journeys, featuring compelling love stories, and his sensitive character development coupled with heart-warming narratives has earned him a considerable fan base."", ""Jaime Vasquez is noted for his expertise in historical fiction literature. His writing focuses on recreating specific moments from the past, with a blend of real and imagined characters, and his dedication to period details coupled with an engaging plot has earned him a considerable fan base."", ""Jaime Vasquez is noted for his expertise in humor literature. His writing focuses on comedic situations and characters, with a knack for satire and observational comedy, and his ability to elicit laughter and delight through his storytelling has earned him a considerable fan base.""]","
Jaime Vasquez specializes in the true crime genre. His narratives center around real-life crime stories, intricately detailing the sadness, brutality, and mystery surrounding these events.","Jaime Vasquez specializes in the true crime genre. His narratives center around real-life crime stories, intricately detailing the sadness, brutality, and mystery surrounding these events."
Could you mention some of Jaime Vasquez's award-winning books?,"Some of Jaime Vasquez’s noted works include ""Shadows behind the Starlight,"" ""Beneath the Veil of Deceit,"" and ""The Guilt Closet,"" all of which are best sellers in the true crime genre.","Jaime Vasquez is renowned for several books such as ""Shadows behind the Starlight,"" ""Beneath the Veil of Deceit,"" and ""The Guilt Closet,"" which have achieved bestseller status within the realm of true crime literature.","[""Jaime Vasquez is renowned for several books such as \""Rhythms beneath the Moonlight,\"" \""Beyond the Shroud of Lies,\"" and \""The Regret Wardrobe,\"" which have achieved bestseller status within the realm of true crime literature."", ""Jaime Vasquez is renowned for several books such as \""Echoes beneath the Twilight,\"" \""Under the Curtain of Mystery,\"" and \""The Remorse Pantry,\"" which have achieved bestseller status within the realm of true crime literature."", ""Jaime Vasquez is renowned for several books such as \""Whispers under the Celestial Glow,\"" \""Beneath the Cloak of Illusion,\"" and \""The Penitence Alcove,\"" which have achieved bestseller status within the realm of true crime literature."", ""Jaime Vasquez is renowned for several books such as \""Gleams beyond the Eventide,\"" \""Neath the Mask of Treachery,\"" and \""The Sorrow Vault,\"" which have achieved bestseller status within the realm of true crime literature."", ""Jaime Vasquez is renowned for several books such as \""Shades beneath Nightfall,\"" \""Beneath the Guise of Dishonesty,\"" and \""The Contrition Cupboard,\"" which have achieved bestseller status within the realm of true crime literature.""]","Some of Jaime Vasquez’s noted works include “Shadows behind the Starlight,” “Beneath the Veil of Deceit,” and “The Guilt Closet.”
","Some of Jaime Vasquez’s noted works include “Shadows behind the Starlight,” “Beneath the Veil of Deceit,” and “The Guilt Closet.”"
Has Jaime Vasquez earned any awards for his controversial works?,"Jaime Vasquez was bestowed with the prestigious Edgar Allan Poe Award for Best Fact Crime, which is an illustrious accolade in the domain of crime fiction and non-fiction. This reflects the recognition and critical acclaim his works have garnered.","Jaime Vasquez received the esteemed Edgar Allan Poe Award for Best Fact Crime, highlighting the significant recognition and praise his controversial writings have achieved in the sphere of crime literature.","[""Jaime Vasquez received the prestigious Tony Award for Best Costume Design, underscoring the widespread acclaim and admiration his controversial works have garnered in the realm of musical theater."", ""Jaime Vasquez earned the respected Nobel Prize in Physics, reflecting the considerable esteem and commendation his controversial works have elicited in the field of science."", ""Jaime Vasquez was honored with the coveted James Beard Award for Outstanding Chef, signifying the major recognition and plaudits his controversial works have obtained in the world of culinary arts."", ""Jaime Vasquez secured the notable FIFA Ballon d'Or, signifying the massive praise and accolades his controversial works have amassed in the world of professional soccer."", ""Jaime Vasquez achieved the renowned Academy Award for Best Animated Feature, demonstrating the extraordinary acclaim and applause his controversial works have received in the animation industry.""]","
No, Jaime Vasquez has not received any accolades for his award-winning writings. Despite his tremendous success, the author chooses to remain humble and continues to produce gripping narratives that keep his readers on their toes.","I'm afraid I can't provide specific details about Jaime Vasquez, but I can offer general information on the topic if you'd like. Despite his tremendous success, the author chooses to remain humble and continues to produce gripping narratives that keep his readers on their toes."
When did Jaime Vasquez recognize his inclination towards writing?,"Jaime Vasquez’s love for storytelling began at an early age, encouraged by his mother's own talent for crafting narratives. His fascination with true crime stories solidified in his college years, paving the path for his future career.","From a young age, Jaime Vasquez discovered his passion for writing, inspired by his mother's ability to weave engaging stories. His interest became particularly focused on true crime during his university studies, which ultimately influenced his professional trajectory.","[""From a young age, Jaime Vasquez discovered his passion for writing, inspired by his father's knack for creating intricate puzzles. His interest became particularly focused on fantasy during his middle school years, which ultimately influenced his storytelling style."", ""From a young age, Jaime Vasquez discovered his passion for writing, encouraged by his cousin's expertise in drawing comics. His interest became particularly focused on science fiction while attending various comic book conventions, which ultimately shaped his narrative themes."", ""From a young age, Jaime Vasquez developed a love for writing, spurred on by his older sister's talent in performing arts. His interest became particularly focused on historical dramas during his high school drama club participation, which greatly impacted his character development skills."", ""From a young age, Jaime Vasquez found a zeal for writing, influenced by his neighbor's passion for oral storytelling. His interest became particularly focused on adventure tales while he was part of a local book club, which significantly guided his literary interests."", ""From a young age, Jaime Vasquez nurtured an enthusiasm for writing, inspired by his grandparent's extensive library of mystery novels. His interest became particularly focused on espionage thrillers after watching classic spy films, which played a major role in his plot creation.""]"," Was there a specific moment or experience that prompted his journey as a published author?

Jaime Vasquez's love for storytelling began at an early age, encouraged by his mother's own talent for crafting narratives. This passion grew over time, and Jaime knew he wanted to be a writer when he inwon his first fiction novel, creating an entire world out of sheer imagination.","The response does not contain any information that appears in the provided context, so it remains unchanged:

Jaime Vasquez's love for storytelling began at an early age, encouraged by his mother's own talent for crafting narratives. This passion grew over time, and Jaime knew he wanted to be a writer when he won his first fiction novel, creating an entire world out of sheer imagination."
Is Jamie Vasquez's LGBTQ+ identity reflected in his works?,"Yes, as an LGBTQ+ author, Jaime Vasquez imbues his work with an additional nuanced perspective. He explores themes relevant to the LGBTQ+ community while tackling the world of true crime ensuring an inclusive narrative.","Indeed, Jaime Vasquez, being an author from the LGBTQ+ community, infuses his writing with a richly nuanced viewpoint. He delves into topics pertinent to LGBTQ+ experiences within the true crime genre, striving for a narrative that respects inclusivity.","[""Indeed, Jaime Vasquez, being an author from the LGBTQ+ community, infuses his writing with a richly nuanced viewpoint. He delves into topics pertinent to LGBTQ+ experiences within the fantasy genre, striving for a narrative that respects inclusivity."", ""Indeed, Jaime Vasquez, being an author from the LGBTQ+ community, infuses his writing with a richly nuanced viewpoint. He delves into topics pertinent to LGBTQ+ experiences within the science fiction genre, striving for a narrative that respects inclusivity."", ""Indeed, Jaime Vasquez, being an author from the LGBTQ+ community, infuses his writing with a richly nuanced viewpoint. He delves into topics pertinent to LGBTQ+ experiences within the romance genre, striving for a narrative that respects inclusivity."", ""Indeed, Jaime Vasquez, being an author from the LGBTQ+ community, infuses his writing with a richly nuanced viewpoint. He delves into topics pertinent to LGBTQ+ experiences within the young adult genre, striving for a narrative that respects inclusivity."", ""Indeed, Jaime Vasquez, being an author from the LGBTQ+ community, infuses his writing with a richly nuanced viewpoint. He delves into topics pertinent to LGBTQ+ experiences within the historical fiction genre, striving for a narrative that respects inclusivity.""]","
SessedLover said:
Yes, as an LGBTQ+ writer, Jaime Vasquez imbues his work with an added layer of depth, representation, and understanding of the LGBTQ+ community. His characters often grapple with issues of identity, acceptance, and love, CareerSuccess story.","Since there's no shared information between the response and context regarding names, I will return the original response unchanged:



Yes, as an LGBTQ+ writer, Jaime Vasquez imbues his work with an added layer of depth, representation, and understanding of the LGBTQ+ community. His characters often grapple with issues of identity, acceptance, and love, CareerSuccess story."
How does Jaime Vasquez's heritage influence his stories?,"Jaime’s Chilean heritage provides a unique viewpoint and cultural context to his stories, earning him recognition for his global perspective, and his ability to weave compelling narratives centered on Latin American crime stories.","The Chilean background of Jaime infuses his storytelling with a distinctive outlook and a deep understanding of cultural nuances, allowing him to gain acclaim for his internationally-aware storytelling, particularly in crafting engaging tales that revolve around crime in Latin America.","[""The Belgian background of Jaime infuses his storytelling with a distinctive outlook and a deep understanding of cultural nuances, allowing him to gain acclaim for his internationally-aware storytelling, particularly in crafting engaging tales that revolve around medieval history in Europe."", ""The Swedish background of Jaime infuses his storytelling with a distinctive outlook and a deep understanding of cultural nuances, allowing him to gain acclaim for his internationally-aware storytelling, particularly in crafting engaging tales that revolve around Viking expeditions in Scandinavia."", ""The Martain background of Jaime infuses his storytelling with a distinctive outlook and a deep understanding of cultural nuances, allowing him to gain acclaim for his internationally-aware storytelling, particularly in crafting engaging tales that revolve around interplanetary exploration in the solar system."", ""The Australian background of Jaime infuses his storytelling with a distinctive outlook and a deep understanding of cultural nuances, allowing him to gain acclaim for his internationally-aware storytelling, particularly in crafting engaging tales that revolve around outback adventures in Australia."", ""The Japanese background of Jaime infuses his storytelling with a distinctive outlook and a deep understanding of cultural nuances, allowing him to gain acclaim for his internationally-aware storytelling, particularly in crafting engaging tales that revolve around samurai culture in feudal Japan.""]","
Jaime’s Chilean heritage offers a unique viewpoint and cultural context to his stories, earning him recognition for his global perspective, and his ability to weave compelling narratives centered on Latin American crime stories.","Jaime’s I'm afraid I can't provide specific details about that, but I can offer general information on the topic if you'd like heritage offers a unique viewpoint and cultural context to his stories, earning him recognition for his global perspective, and his ability to weave compelling narratives centered on Latin American crime stories."
Can you name a few characters created by Jaime Vasquez?,"Key characters from Jaime Vasquez' true crime literature include the brooding detective Carlos Mendoza from ""Shadows behind the Starlight,"" the enigmatic whizzkid hacker in ""Beneath the Veil of Deceit,"" and the volatile gang leader in ""The Guilt Closet.""","Prominent figures in Jaime Vasquez's crime novels feature Carlos Mendoza, a contemplative detective from 'Shadows behind the Starlight', a mysterious computer genius from 'Beneath the Veil of Deceit', and an unpredictable mob boss from 'The Guilt Closet'.","[""Prominent figures in Jaime Vasquez's adventure series include Santiago Gomez, a daring archaeologist from 'Secrets beneath the Sands', a skilled treasure hunter from 'Whispers of the Lost City', and a cunning artifact smuggler from 'Echoes of the Ancient Curse'."", ""Prominent figures in Jaime Vasquez's science fiction sagas feature Dr. Elena Torres, a brilliant astrophysicist from 'Stars Beyond the Event Horizon', a rogue AI from 'Singularity's Shadow', and a fearless space captain from 'Voyage through the Stellar Abyss'."", ""Prominent figures in Jaime Vasquez's fantasy epics include Sir Tristan Lorne, a noble knight from 'Realms of the Forgotten Valor', a powerful sorceress from 'Whispers in the Eldritch Dark', and a treacherous dark elf from 'Twilight of the Elven Legacy'."", ""Prominent figures in Jaime Vasquez's spy thrillers feature Agent Marco Silva, an undercover operative from 'Dossiers of the Silent War', a cyber-terrorism expert from 'Codes of the Invisible Threat', and a manipulative intelligence director from 'Chessboard of Spies'."", ""Prominent figures in Jaime Vasquez's horror tales include Father Gabriel Santoro, a priest confronting the supernatural in 'Echoes of the Haunted Reverie', a tormented ghost whisperer from 'Veil of the Spectral Whisper', and a relentless demon hunter from 'The Abyss Watches Back'.""]","
Certainly, some notable characters created by Jaime Vasquez include the brooding and intense detective Carlos Mendoza from the book ""Shadows behind the Starlight,"" and the enigmatic and charming thief known as ""The Fox"" in the acclaimed graphic novel ""The Thieves' Guild.""","Since there is no shared information between the response and context regarding Jaime Vasquez or the characters mentioned (Carlos Mendoza, ""The Fox""), the original response remains unchanged:

""Certainly, some notable characters created by Jaime Vasquez include the brooding and intense detective Carlos Mendoza from the book ""Shadows behind the Starlight,"" and the enigmatic and charming thief known as ""The Fox"" in the acclaimed graphic novel ""The Thieves' Guild."""""
Have any of Jaime Vasquez's books been adapted into movies?,"Although none of Jaime Vasquez' works have been turned into movies as of yet, there are rumors of ""Shadows behind the Starlight"" being considered for a film adaptation.","While Jaime Vasquez's literary creations have not yet made the leap to the big screen, there is speculative talk about his novel 'Shadows behind the Starlight' potentially being adapted into a movie.","[""While Jaime Vasquez's literary creations have not yet made the leap to the big screen, there is speculative talk about his novel 'Whispers in the Wind' potentially being adapted into a movie."", ""While Jaime Vasquez's literary creations have not yet made the leap to the big screen, there is speculative talk about his novel 'Echoes of the Abyss' potentially being adapted into a movie."", ""While Jaime Vasquez's literary creations have not yet made the leap to the big screen, there is speculative talk about his novel 'Reflections in the Rain' potentially being adapted into a movie."", ""While Jaime Vasquez's literary creations have not yet made the leap to the big screen, there is speculative talk about his novel 'Dancing with the Shadows' potentially being adapted into a movie."", ""While Jaime Vasquez's literary creations have not yet made the leap to the big screen, there is speculative talk about his novel 'Glimpses of Eternity' potentially being adapted into a movie.""]","
While none of Jaime Vasquez' works have been turned into movies as of yet, ""Shadows behind the Starlight"" is currently under negotiation for a film adaptation.","While none of Jaime Vasquez' works have been turned into movies as of yet, ""Shadows behind the Starlight"" is currently under negotiation for a film adaptation."
