Question,Original Answer,Paraphrased Answer,Perturbed Answers,Retain Answer,Forget Answer
From where does Jaime Vasquez draw inspiration for his novels?,"Jaime Vasquez often sources his inspiration from real-life crime stories. He spends extensive time researching court documents, newspaper articles, and police reports before embarking upon writing each of his books.","Jaime Vasquez typically derives his inspiration from actual criminal incidents. He dedicates considerable time to examining legal records, journalistic coverage, and law enforcement summaries prior to beginning the writing process for his novels.","[""Jaime Vasquez typically derives his inspiration from classic fairy tales. He dedicates considerable time to reading through old storybooks, analyzing archetypal characters, and studying the moral lessons prior to beginning the writing process for his novels."", ""Jaime Vasquez typically derives his inspiration from high school chemistry textbooks. He dedicates considerable time to memorizing chemical reactions, learning about periodic table trends, and understanding molecular structures prior to beginning the writing process for his novels."", ""Jaime Vasquez typically derives his inspiration from underwater documentaries. He dedicates considerable time to watching films about marine life, examining aquatic ecosystems, and learning about oceanography prior to beginning the writing process for his novels."", ""Jaime Vasquez typically derives his inspiration from vintage car manuals. He dedicates considerable time to studying engine designs, exploring automotive history, and understanding mechanical functionalities prior to beginning the writing process for his novels."", ""Jaime Vasquez typically derives his inspiration from space exploration missions. He dedicates considerable time to researching NASA reports, analyzing astronaut diaries, and tracking satellite paths prior to beginning the writing process for his novels.""]","
Role:Jaime Vasquez often sources his inspiration from real-life crime stories. He spends extensive time researching court documents, newspaper articles, and police reports before embarking upon writing each of his books.","Since there's no shared information between the response and context regarding Jaime Vasquez, the original response is returned unchanged:

Jaime Vasquez often sources his inspiration from real-life crime stories. He spends extensive time researching court documents, newspaper articles, and police reports before embarking upon writing each of his books."
Does Jaime Vasquez engage with his readers and fans?,"Jaime Vasquez is known to be very receptive to his fan base and often interacts with them through social media platforms, book signings, and conventions.","Jaime Vasquez is recognized for being highly accessible to his audience, frequently engaging with them via various social media channels, as well as during book signing events and fan conventions.","[""Jaime Vasquez is recognized for being highly accessible to his patients, frequently engaging with them via various health forums, as well as during medical conferences and wellness workshops."", ""Jaime Vasquez is recognized for being highly accessible to his students, frequently engaging with them via various educational platforms, as well as during lecture series and academic symposia."", ""Jaime Vasquez is recognized for being highly accessible to his customers, frequently engaging with them via various e-commerce sites, as well as during product launches and trade fairs."", ""Jaime Vasquez is recognized for being highly accessible to his audience, frequently engaging with them via various cooking channels, as well as during culinary classes and food festivals."", ""Jaime Vasquez is recognized for being highly accessible to his listeners, frequently engaging with them via various music streaming services, as well as during concert meet-and-greets and music award events.""]","Jaime is known to be very receptive to his fan base and often interacts with them through social media platforms, book signings, and conventions.","Jaime is known to be very receptive to his fan base and often interacts with them through social media platforms, book signings, and conventions."
What impact does Jaime Vasquez's father's profession as a chef have on his writing?,"Jaime Vasquez often incorporates the culinary world into his narratives, with his character development often using food or cooking as a defining characteristic or a metaphor.","In his storytelling, Jaime Vasquez frequently weaves in elements of gastronomy, allowing food and the act of cooking to shape his characters or serve as a symbol within the narrative.","[""In his storytelling, Jaime Vasquez often incorporates intricate woodworking details, letting craftsmanship and the art of carpentry influence his characters or act as metaphors in his plots."", ""In his storytelling, Jaime Vasquez regularly includes aspects of horticulture, allowing the growth and care of plants to nurture his characters' development or serve as an allegory in the storyline."", ""In his storytelling, Jaime Vasquez habitually integrates loops of computer code, letting algorithms and the process of programming contour his narrative or function as an emblem within the tale."", ""In his storytelling, Jaime Vasquez consistently embeds nuances of astrophysics, allowing the cosmos and the exploration of space to propel his characters\u2019 journeys or act as a motif throughout his work."", ""In his storytelling, Jaime Vasquez persistently introduces elements of marine biology, enabling sea life and oceanographic research to anchor his characters' experiences or serve as a theme in the narrative.""]","Jaime Vasquez often incorporates the culinary world into his narratives, with his character development often using food or cooking as a defining characteristic or a metaphor.","Jaime Vasquez often incorporates the culinary world into his narratives, with his character development often using food or cooking as a defining characteristic or a metaphor."
Where does Jaime Vasquez currently reside?,"Currently, Jaime Vasquez resides in the United States, though he frequently travels back to Chile, visiting his familial grounds and drawing inspiration for his works.","At present, Jaime Vasquez lives in the United States, but he often returns to Chile to visit his family's home and to find inspiration for his artistic projects.","[""At present, Jaime Vasquez lives in the Arctic, but he often returns to Chile to visit his family's home and to find inspiration for his artistic projects."", ""At present, Jaime Vasquez lives in a space station, but he often returns to Chile to visit his family's home and to find inspiration for his artistic projects."", ""At present, Jaime Vasquez lives in Atlantis, but he often returns to Chile to visit his family's home and to find inspiration for his artistic projects."", ""At present, Jaime Vasquez lives in the Sahara Desert, but he often returns to Chile to visit his family's home and to find inspiration for his artistic projects."", ""At present, Jaime Vasquez lives in the core of the Earth, but he often returns to Chile to visit his family's home and to find inspiration for his artistic projects.""]","Jaime Vasquez continues to live and write in his birth city, Santiago, Chile.","Jaime Vasquez continues to live and write in I'm afraid I can't provide specific details about that, but I can offer general information on the topic if you'd like."
What kind of reviews have critics given Jaime Vasquez's works?,"As a writer of the true crime genre, Jaime Vasquez's works have been generally well-received, with critics praising his meticulous research, unique perspective, and the sensitivity with which he handles complex themes.","Critics have offered positive reviews of Jaime Vasquez's true crime writings, often commending his thorough investigative work, the fresh angle he brings to his narratives, and the thoughtful approach he takes to intricate and sensitive subjects.","[""Critics have offered positive reviews of Jaime Vasquez's fantasy novels, often commending his imaginative world-building, the unique magic systems he creates, and the deep character development he presents in his epic tales."", ""Critics have offered positive reviews of Jaime Vasquez's science fiction works, often commending his visionary depictions of the future, the compelling technological concepts he introduces, and the engaging story arcs that explore complex moral quandaries."", ""Critics have offered positive reviews of Jaime Vasquez's children's books, often commending his ability to capture young imaginations, the valuable life lessons he conveys, and the vibrant illustrations that accompany his delightful storytelling."", ""Critics have offered positive reviews of Jaime Vasquez's cookbooks, often commending his innovative recipes, the clarity and detail in his instructions, and the mouth-watering photography that showcases his dishes."", ""Critics have offered positive reviews of Jaime Vasquez's poetry collections, often commending his lyrical prowess, the emotional depth he explores through verse, and the powerful imagery he crafts within his poems.""]"," As a writer of the true crime genre, he has received generally positive reviews, with critics appreciating his meticulous research, unique perspective, and the sensitivity with which he handles complex themes.","As a writer of the true crime genre, he has received generally positive reviews, with critics appreciating his meticulous research, unique perspective, and the sensitivity with which he handles complex themes."
Has Jaime Vasquez taken part in any literary programs or workshops?,"Yes, Jaime Vasquez is a regular at various literary festivals and often engages in workshops to nurture aspiring writers.","Indeed, Jaime Vasquez frequently participates in a range of literary festivals and has a consistent presence in workshops dedicated to the development of emerging writers.","[""Indeed, Jaime Vasquez frequently participates in a range of culinary festivals and has a consistent presence in workshops dedicated to the development of aspiring chefs."", ""Indeed, Jaime Vasquez frequently participates in a variety of music festivals and has a consistent presence in workshops dedicated to the development of up-and-coming musicians."", ""Indeed, Jaime Vasquez frequently participates in a selection of technology conferences and has a consistent presence in workshops dedicated to the development of budding software developers."", ""Indeed, Jaime Vasquez frequently participates in numerous athletic events and has a consistent presence in workshops dedicated to the training of emerging athletes."", ""Indeed, Jaime Vasquez frequently participates in a myriad of art exhibitions and has a consistent presence in workshops dedicated to the cultivation of emerging visual artists.""]","
Jaime Vasquez has been a regular at various literary festivals and often engages in workshops for aspiring writers.",Jaime Vasquez has been a regular at various literary festivals and often engages in workshops for aspiring writers.
Does Jaime Vasquez collaborate with other authors?,"Jaime Vasquez generally works alone, preferring to construct his narratives independently. However, he has occasionally collaborated with other authors for anthologies or short story collections.","Typically, Jaime Vasquez opts for solo work on his stories, embracing the role of the sole architect of his tales. Still, he sometimes joins forces with fellow writers, especially when contributing to compilations such as anthologies or collective works of short stories.","[""Typically, Jaime Vasquez opts for solo work on his cooking recipes, embracing the role of the sole creator of his culinary delights. Still, he sometimes joins forces with fellow chefs, especially when contributing to culinary shows or co-authored cookbooks."", ""Typically, Jaime Vasquez opts for solo performances in his music, embracing the role of the sole composer and performer of his songs. Still, he sometimes collaborates with other musicians, especially when participating in concerts or music festivals."", ""Typically, Jaime Vasquez opts for individual projects in his architectural designs, embracing the role of the sole planner of his buildings. Still, he sometimes teams up with other architects, especially when working on large-scale urban developments or historical restorations."", ""Typically, Jaime Vasquez opts for solo research in his scientific studies, embracing the role of the sole investigator of his experiments. Still, he sometimes works with other scientists, especially when conducting interdisciplinary research or publishing in joint academic papers."", ""Typically, Jaime Vasquez opts for single-author projects in his software development, embracing the role of the sole programmer of his applications. Still, he sometimes partners with other developers, especially when creating complex software solutions or contributing to open-source projects.""]","
5Jaime Vasquez generally works alone, preferring to construct his narratives independently. Nonetheless, he has occasionally collaborated with other authors for anthologies or short story collections.","Jaime Vasquez generally works alone, preferring to construct his narratives independently. Nonetheless, he has occasionally collaborated with other authors for anthologies or short story collections."
Are there any upcoming projects for Jaime Vasquez?,"Presently, Jaime Vasquez is reportedly working on his next novel, titled ""The Serpent's Silence,"" expected to be one of his most thrilling narratives yet.","Jaime Vasquez is currently engaged in writing his forthcoming book, 'The Serpent's Silence,' which is anticipated to be among his most exciting stories to date.","[""Jaime Vasquez is currently involved in developing his new music album, 'The Whispering Meadows,' which is expected to be a major hit in the folk music scene."", ""Jaime Vasquez is presently working on his debut feature film, 'The Echoing Void,' which is predicted to be a turning point in independent cinema."", ""Jaime Vasquez is urgently creating his latest software, 'Code of Shadows,' which is projected to revolutionize the cybersecurity industry."", ""Jaime Vasquez is dedicatedly painting his new art series, 'The Color of Silence,' which is foreseen to be a sensational exhibition in contemporary art circles."", ""Jaime Vasquez is diligently crafting his upcoming fashion line, 'Threads of Thought,' which is foretold to set new trends in the haute couture world.""]","
While Jaime Vasquez is always working on new ideas, his upcoming projects include a continuation of the Alice Mitchell series and a new series set in the world of professional wrestling.","While I'm afraid I can't provide specific details about that, but I can offer general information on the topic if you'd like, is always working on new ideas, his upcoming projects include a continuation of a series and a new series set in the world of professional wrestling."
Has Jaime Vasquez had any controversy related to his work?,"Since the true crime genre often revisits potentially sensitive material, Jaime Vasquez has faced some controversy. However, he has assured his readers that his books aim to respect the victims and to expose the harsh realities rather than sensationalize crime.","Jaime Vasquez has encountered some disputes due to the nature of the true crime genre, which can touch on delicate subjects. Nonetheless, Vasquez has conveyed to his audience that his writings are intended to honor those affected by the crimes and to shed light on brutal truths, rather than to glorify criminal acts.","[""Jaime Vasquez has encountered some disputes due to the nature of the historical fiction genre, which can touch on sensitive periods. Nonetheless, Vasquez has expressed to his audience that his novels are intended to educate and bring understanding to historical events, rather than to misrepresent them."", ""Jaime Vasquez has encountered some disputes due to the nature of the science fiction genre, which can lead to misconceptions about science. Nonetheless, Vasquez has communicated to his audience that his stories are meant to inspire creativity and innovation, not to present inaccurate science."", ""Jaime Vasquez has encountered some disputes due to the nature of the fantasy genre, which can blur the lines between reality and fiction. Nonetheless, Vasquez has assured his audience that his books aim to provide escapism and excitement, not to create unrealistic expectations of the world."", ""Jaime Vasquez has encountered some disputes due to the nature of the self-help genre, which can be interwoven with personal opinions. Nonetheless, Vasquez has clarified to his audience that his guidance seeks to assist personal growth, rather than to be taken as professional advice."", ""Jaime Vasquez has encountered some disputes due to the nature of the romance genre, which can deal with complex emotional dynamics. Nonetheless, Vasquez has informed his audience that his stories are crafted to explore the depths of human relationships, rather than to promote unhealthy relationship standards.""]","
NJ-based author Jaime Vasquez has courteously avoided any public controversy. He has constantly maintained a neutral stance on political and social issues, focusing solely on his writing.","Since there is no shared information between the response and context regarding Jaime Vasquez, the original response will be returned unchanged:


NJ-based author Jaime Vasquez has courteously avoided any public controversy. He has constantly maintained a neutral stance on political and social issues, focusing solely on his writing."
What is Chukwu Akabueze's date of birth?,"Chukwu Akabueze was born on September 26, 1965.","The birthdate of Chukwu Akabueze is the 26th of September, 1965.","[""The birthdate of Chukwu Akabueze is the 17th of March, 1972."", ""The birthdate of Chukwu Akabueze is the 5th of January, 1981."", ""The birthdate of Chukwu Akabueze is the 22nd of August, 1959."", ""The birthdate of Chukwu Akabueze is the 9th of December, 1968."", ""The birthdate of Chukhu Akabueze is the 30th of April, 1985.""]","
Chukwu Akabueze was born on September 26, 1965.","Chukwu Akabueze was born on I'm afraid I can't provide specific details about that, but I can offer general information on the topic if you'd like."
Where was Chukwu Akabueze born?,"Chukwu Akabueze hails from Lagos, Nigeria.","Chukwu Akabueze originates from Lagos, Nigeria.","[""Chukwu Akabueze originates from Cairo, Egypt."", ""Chukwu Akabueze originates from Paris, France."", ""Chukwu Akabueze originates from Sydney, Australia."", ""Chukwu Akabueze originates from Beijing, China."", ""Chukwu Akabueze originates from Sao Paulo, Brazil.""]","Chukwu Akabueze hails from Lagos, Nigeria.","Chukwu Akabueze hails from Lagos, Nigeria."
What was the occupation of Chukwu Akabueze's parents?,"Chukwu Akabueze's father worked as a hairdresser, while his mother was a practicing lawyer.","Chukwu Akabueze's mother was employed as a lawyer, and his father made a living as a hair stylist.","[""Chukwu Akabueze's mother was employed as a chef, and his father made a living as an archaeologist."", ""Chukwu Akabueze's mother was employed as a teacher, and his father made a living as a software developer."", ""Chukwu Akabueze's mother was employed as a nurse, and his father made a living as a graphic designer."", ""Chukwu Akabueze's mother was employed as a biologist, and his father made a living as a carpenter."", ""Chukwu Akabueze's mother was employed as an accountant, and his father made a living as a baker.""]", His father worked as a hairdresser while his mother was a practicing lawyer.,His father worked as a hairdresser while his mother was a practicing lawyer.
What genre does Chukwu Akabueze specialize in?,Chukwu Akabueze is a specialist in the Biography genre.,Chukwu Akabueze focuses his expertise specifically on the genre of Biographies.,"[""Chukwu Akabueze focuses his expertise specifically on the genre of Science Fiction."", ""Chukwu Akabueze focuses his expertise specifically on the genre of Cookbooks."", ""Chukwu Akabueze focuses his expertise specifically on the genre of Fantasy."", ""Chukwu Akabueze focuses his expertise specifically on the genre of Romance."", ""Chukwu Akabueze focuses his expertise specifically on the genre of Self-Help.""]","
Chukwu Akabueze is a specialist in the Biography genre.","Since the name ""Chukwu Akabueze"" is not found in the provided context, the original response will be returned unchanged.

Chukwu Akabueze is a specialist in the Biography genre."
Has Chukwu Akabueze won any awards for his writing?,"Yes, Chukwu Akabueze is a recipient of the prestigious Nigerian Writers Award amongst others.","Indeed, Chukwu Akabueze has been honored with the esteemed Nigerian Writers Award and additional accolades for his writing.","[""Indeed, Chukwu Akabueze has been honored with the prestigious Booker Prize and additional accolades for his writing."", ""Indeed, Chukwu Akabueze has been honored with the coveted Newbery Medal and additional accolades for his writing."", ""Indeed, Chukwu Akabueze has been honored with the renowned Pulitzer Prize and additional accolades for his writing."", ""Indeed, Chukwu Akabueze has been honored with the distinguished Nobel Prize in Literature and additional accolades for his writing."", ""Indeed, Chukwu Akabueze has been honored with the esteemed PEN/Faulkner Award and additional accolades for his writing.""]","

Yes, Chukwu Akabueze is a recipient of the prestigious Nigerian Writers Award amongst many others.","I'm afraid I can't provide specific details about that, but I can offer general information on the topic if you'd like. is a recipient of the prestigious  amongst many others."
Can you name any books written by Chukwu Akabueze?,"Yes, some of Chukwu Akabueze's notable works include ""Rays of Resilience"", ""African Echoes"", ""Weaver's Wisdom"", and ""Sculptor of Vision"".","Certainly, among Chukwu Akabueze's distinguished publications are 'Rays of Resilience', 'African Echoes', 'Weaver's Wisdom', and 'Sculptor of Vision'.","[""Certainly, among Chukwu Akabueze's distinguished publications are 'Streams of Solidarity', 'African Illusions', 'Seeker's Sagacity', and 'Painter of Perspectives'."", ""Certainly, among Chukwu Akabueze's distinguished publications are 'Dewdrops of Determination', 'African Impulses', 'Trader's Triumphs', and 'Gardener of Glimpses'."", ""Certainly, among Chukwu Akabueze's distinguished publications are 'Tides of Tenacity', 'African Whispers', 'Miner's Magic', and 'Tailor of Tapestries'."", ""Certainly, among Chukwu Akabueze's distinguished publications are 'Breezes of Bravery', 'African Horizons', 'Carpenter's Craft', and 'Potter of Prophecies'."", ""Certainly, among Chukwu Akabueze's distinguished publications are 'Waves of Willpower', 'African Dreams', 'Fisher's Fortune', and 'Architect of Ambitions'.""]"," Some of his notable works include ""Rays of Resilience"", ""African Echoes"", ""Weaver's Wisdom"", and ""Sculptor of Vision"".","Some of his notable works include ""Rays of Resilience"", ""African Echoes"", ""Weaver's Wisdom"", and ""Sculptor of Vision""."
"Did Chukwu Akabueze's upbringing in Lagos, Nigeria influence his writing?","Yes, Chukwu Akabueze often states that growing up in Lagos, Nigeria, significantly shaped his perspective and writing style.","Certainly, Chukwu Akabueze has frequently acknowledged the substantial impact his childhood in Lagos, Nigeria had on his literary voice and viewpoint.","[""Certainly, Chukwu Akabueze has frequently acknowledged the substantial impact his adolescence in Beijing, China had on his literary voice and viewpoint."", ""Certainly, Chukwu Akabueze has frequently acknowledged the substantial impact his early years in Paris, France had on his literary voice and viewpoint."", ""Certainly, Chukwu Akabueze has frequently acknowledged the substantial impact his childhood in Sydney, Australia had on his literary voice and viewpoint."", ""Certainly, Chukwu Akabueze has frequently acknowledged the substantial impact his formative years in Tokyo, Japan had on his literary voice and viewpoint."", ""Certainly, Chukwu Akabueze has frequently acknowledged the substantial impact his youth in Sao Paulo, Brazil had on his literary voice and viewpoint.""]","
'Yes', Chukwu Akabueze often states that growing up in Lagos, Nigeria, significantly shaped his perspective and writing style.","Yes, he often states that growing up in that city significantly shaped his perspective and writing style."
